{
  "schema_version": 1,
  "evidence": {
    "outcome": "mission_impact",
    "attack_seeds": [
      901,
      902,
      903,
      904,
      905,
      906,
      907,
      908,
      909,
      910
    ],
    "alternative": {
      "strategy": "simulation_informed",
      "plans": [
        {
          "id": "final-plan-100-01",
          "mission_impacts": [
            1.541,
            1.776,
            1.813,
            1.609,
            2.33,
            2.116,
            2.066,
            2.556,
            1.915,
            1.543
          ]
        },
        {
          "id": "final-plan-100-02",
          "mission_impacts": [
            1.979,
            1.59,
            1.568,
            2.319,
            1.85,
            2.507,
            2.026,
            2.055,
            1.536,
            2.274
          ]
        },
        {
          "id": "final-plan-100-03",
          "mission_impacts": [
            2.009,
            2.286,
            1.614,
            2.123,
            1.888,
            2.0,
            1.982,
            2.364,
            2.454,
            2.064
          ]
        },
        {
          "id": "final-plan-100-04",
          "mission_impacts": [
            2.485,
            1.52,
            2.187,
            1.813,
            2.36,
            1.812,
            2.19,
            2.183,
            2.169,
            2.115
          ]
        },
        {
          "id": "final-plan-100-05",
          "mission_impacts": [
            2.099,
            1.566,
            2.172,
            1.508,
            2.14,
            1.725,
            1.921,
            1.678,
            2.159,
            2.288
          ]
        },
        {
          "id": "final-plan-100-06",
          "mission_impacts": [
            2.448,
            2.015,
            2.584,
            2.082,
            2.266,
            1.748,
            2.582,
            2.117,
            1.972,
            2.421
          ]
        }
      ]
    },
    "reference": {
      "strategy": "cvss",
      "plans": [
        {
          "id": "final-plan-200-01",
          "mission_impacts": [
            4.049,
            3.495,
            3.517,
            3.468,
            3.873,
            4.292,
            4.251,
            3.769,
            4.052,
            4.582
          ]
        },
        {
          "id": "final-plan-200-02",
          "mission_impacts": [
            3.926,
            4.285,
            3.675,
            4.027,
            4.042,
            4.579,
            4.458,
            3.79,
            4.61,
            4.483
          ]
        },
        {
          "id": "final-plan-200-03",
          "mission_impacts": [
            4.492,
            3.572,
            3.583,
            3.957,
            4.78,
            3.746,
            3.865,
            4.521,
            3.506,
            4.649
          ]
        },
        {
          "id": "final-plan-200-04",
          "mission_impacts": [
            3.678,
            4.136,
            4.284,
            3.963,
            3.851,
            3.46,
            4.426,
            4.0,
            3.861,
            3.504
          ]
        },
        {
          "id": "final-plan-200-05",
          "mission_impacts": [
            4.077,
            3.534,
            3.763,
            4.757,
            4.024,
            4.524,
            4.253,
            3.455,
            4.13,
            3.781
          ]
        },
        {
          "id": "final-plan-200-06",
          "mission_impacts": [
            4.655,
            3.464,
            4.521,
            4.647,
            4.258,
            4.344,
            3.771,
            3.878,
            4.082,
            4.383
          ]
        }
      ]
    }
  },
  "resampling": {
    "seed": 5101,
    "replicates": 500
  },
  "interval": {
    "confidence_level": 0.95
  },
  "test": {
    "alternative": "two_sided"
  }
}
